{
  "$schema": "http://json-schema.org/draft-04/schema#",
  "type": "object",
  "properties": {
    "message": {
      "type": "string"
    },
    "success": {
      "type": "boolean"
    },
    "status": {
      "type": "integer"
    },
    "response": {
      "type": "array",
      "items": [
        {
          "type": "object",
          "properties": {
            "lastUpdatedDate": {
              "type": "string"
            },
            "lastUpdatedBy": {
              "type": "string"
            },
            "createdDate": {
              "type": "string"
            },
            "createdBy": {
              "type": "string"
            },
            "id": {
              "type": "integer"
            },
            "customerId": {
              "type": "string"
            },
            "energyPlanInfo": {
              "type": "object",
              "properties": {
                "lastUpdatedDate": {
                  "type": "string"
                },
                "lastUpdatedBy": {
                  "type": "string"
                },
                "createdDate": {
                  "type": "string"
                },
                "createdBy": {
                  "type": "string"
                },
                "id": {
                  "type": "integer"
                },
                "offer": {
                  "type": "object",
                  "properties": {
                    "lastUpdatedDate": {
                      "type": "string"
                    },
                    "lastUpdatedBy": {
                      "type": "string"
                    },
                    "createdDate": {
                      "type": "string"
                    },
                    "createdBy": {
                      "type": "string"
                    },
                    "offerCode": {
                      "type": "string"
                    },
                    "offerName": {
                      "type": "string"
                    },
                    "countryCode": {
                      "type": "string"
                    },
                    "countryName": {
                      "type": "string"
                    },
                    "offerImagePath": {
                      "type": "string"
                    },
                    "status": {
                      "type": "integer"
                    },
                    "description": {
                      "type": "string"
                    },
                    "startDate": {
                      "type": "string"
                    },
                    "endDate": {
                      "type": "string"
                    }
                  },
                  "required": [
                    "lastUpdatedDate",
                    "lastUpdatedBy",
                    "createdDate",
                    "createdBy",
                    "offerCode",
                    "offerName",
                    "countryCode",
                    "countryName",
                    "offerImagePath",
                    "status",
                    "description",
                    "startDate",
                    "endDate"
                  ]
                },
                "planDuration": {
                  "type": "integer"
                },
                "planType": {
                  "type": "string"
                },
                "monthlyPackage": {
                  "type": "integer"
                },
                "swapCount": {
                  "type": "integer"
                },
                "dailyPayValue": {
                  "type": "integer"
                },
                "percentageBenefit": {
                  "type": "integer"
                },
                "costOnDemand": {
                  "type": "integer"
                },
                "costSaving": {
                  "type": "integer"
                },
                "status": {
                  "type": "integer"
                },
                "isAvailed": {
                  "type": "integer"
                }
              },
              "required": [
                "lastUpdatedDate",
                "lastUpdatedBy",
                "createdDate",
                "createdBy",
                "id",
                "offer",
                "planDuration",
                "planType",
                "monthlyPackage",
                "swapCount",
                "dailyPayValue",
                "percentageBenefit",
                "costOnDemand",
                "costSaving",
                "status",
                "isAvailed"
              ]
            },
            "startDate": {
              "type": "string"
            },
            "endDate": {
              "type": "string"
            },
            "status": {
              "type": "integer"
            },
            "availedSwaps": {
              "type": "integer"
            },
            "totalAmountPaid": {
              "type": "integer"
            },
            "daysPaid": {
              "type": "integer"
            },
            "missedDays": {
              "type": "integer"
            },
            "overdueAmount": {
              "type": "integer"
            }
          },
          "required": [
            "lastUpdatedDate",
            "lastUpdatedBy",
            "createdDate",
            "createdBy",
            "id",
            "customerId",
            "energyPlanInfo",
            "startDate",
            "endDate",
            "status",
            "availedSwaps",
            "totalAmountPaid",
            "daysPaid",
            "missedDays",
            "overdueAmount"
          ]
        }
      ]
    }
  },
  "required": [
    "message",
    "success",
    "status",
    "response"
  ]
}